{
  "$schema": "https://json-schema.org/draft/2020-12/schema",
  "$id": "https://sorage.local/schemas/config.schema.json",
  "title": "Sorage Configuration",
  "description": "Configuration for Sorage (소라게), the local document handoff and review broker. Every leaf except `installationId` declares its normative fixed default, and `sorage config show --json` on a fresh installation returns the generated installation identifier together with exactly those defaults (CFG-020).",
  "type": "object",
  "additionalProperties": false,
  "required": [
    "schemaVersion",
    "configRevision",
    "installationId",
    "vault",
    "server",
    "handoff",
    "artifact",
    "gitBackup",
    "ui",
    "logging",
    "gc"
  ],
  "properties": {
    "schemaVersion": {
      "description": "Configuration schema version. Raised only by a schema migration (CFG-001).",
      "type": "integer",
      "const": 1,
      "default": 1
    },
    "configRevision": {
      "description": "Monotonic revision incremented by every Sorage-mediated write (CFG-002).",
      "type": "integer",
      "minimum": 1,
      "default": 1
    },
    "installationId": {
      "description": "Stable installation identity generated by `sorage init` and preserved across `sorage backup restore` (CFG-003, VLT-019). It is the only leaf without a fixed default, because a fresh installation generates a new random UUID.",
      "type": "string",
      "format": "uuid"
    },
    "vault": {
      "type": "object",
      "additionalProperties": false,
      "required": [
        "path",
        "importMode"
      ],
      "properties": {
        "path": {
          "description": "Vault directory. Changed only through `sorage vault move --to <path>`, never by editing this file (CFG-013, CFG-014, VLT-001).",
          "type": "string",
          "minLength": 1,
          "default": "~/.sorage/vault"
        },
        "importMode": {
          "description": "The MVP imports Artifacts by copy only (VLT-004).",
          "const": "copy",
          "default": "copy"
        }
      }
    },
    "server": {
      "type": "object",
      "additionalProperties": false,
      "required": [
        "host",
        "port",
        "autoStart",
        "openBrowserOnStart"
      ],
      "properties": {
        "host": {
          "description": "Loopback bind address. Only the two loopback literals are accepted; the name `localhost` is rejected because it can resolve off-loopback (SEC-001).",
          "enum": [
            "127.0.0.1",
            "::1"
          ],
          "default": "127.0.0.1"
        },
        "port": {
          "description": "Daemon port, milestone M2. A change requires a controlled daemon restart (RUN-008), and a bound port fails with PORT_IN_USE (RUN-013).",
          "type": "integer",
          "minimum": 1024,
          "maximum": 65535,
          "default": 46321
        },
        "autoStart": {
          "description": "Start the daemon automatically where the platform supports it, milestone M2.",
          "type": "boolean",
          "default": false
        },
        "openBrowserOnStart": {
          "description": "Open the Web UI when the daemon starts, milestone M2.",
          "type": "boolean",
          "default": false
        }
      }
    },
    "handoff": {
      "type": "object",
      "additionalProperties": false,
      "required": [
        "allowUnregisteredSenders",
        "requireRegisteredRecipient",
        "inboxMarker"
      ],
      "properties": {
        "allowUnregisteredSenders": {
          "description": "Allow an unregistered Workspace to send. Receiving always requires a registered, bound Project (PRJ-013, PRJ-014).",
          "type": "boolean",
          "default": true
        },
        "requireRegisteredRecipient": {
          "description": "A recipient MUST be an active registered Project; this is fixed by PRJ-012 and cannot be turned off.",
          "const": true,
          "default": true
        },
        "inboxMarker": {
          "description": "When true, every Handoff creation or state change rewrites the recipient's derived marker `.sorage/INBOX.md` under each recipient binding directory. The marker is never authoritative. Independently of this key, requested Sorage project setup ensures `.sorage/` is ignored in the Project's `.gitignore` by default, preserving existing entries and avoiding duplicates; the CLI does not automatically edit that file (HND-026).",
          "type": "boolean",
          "default": false
        }
      }
    },
    "artifact": {
      "type": "object",
      "additionalProperties": false,
      "required": [
        "maxBytes",
        "externalSourcePolicy",
        "verifyChecksumOnFetch"
      ],
      "properties": {
        "maxBytes": {
          "description": "Maximum accepted body size for Handoff Artifacts, Project Memo bodies, and Channel messages, enforced mid-stream during import and never by buffering the whole body (VLT-015, NFR-005, SHR-002).",
          "type": "integer",
          "minimum": 1,
          "default": 104857600
        },
        "externalSourcePolicy": {
          "description": "`workspace_or_explicit` allows a source outside the resolved sender workspace with `--allow-external-source`; `workspace_only` removes that override (VLT-016).",
          "enum": [
            "workspace_only",
            "workspace_or_explicit"
          ],
          "default": "workspace_or_explicit"
        },
        "verifyChecksumOnFetch": {
          "description": "Re-hash the current Artifact on every fetch. Default false because fetch is the hot read path and re-hashing a 100 MiB Artifact on every call is expensive for a failure mode already covered by `vault verify`, `backup verify`, and the mandatory verification inside revise, accept, backup, and restore (VLT-023). Enable it on installations that store small documents and want immediate detection.",
          "type": "boolean",
          "default": false
        }
      }
    },
    "gitBackup": {
      "type": "object",
      "additionalProperties": false,
      "required": [
        "enabled",
        "schedule",
        "commit",
        "push",
        "largeArtifactWarningBytes",
        "snapshot"
      ],
      "properties": {
        "enabled": {
          "description": "Git backup of the Vault, milestone M3. Off by default so a milestone M1 installation has no Git dependency (BKP-001).",
          "type": "boolean",
          "default": false
        },
        "schedule": {
          "type": "object",
          "additionalProperties": false,
          "required": [
            "type",
            "at",
            "timezone",
            "catchUpAfterMissedRun"
          ],
          "properties": {
            "type": {
              "description": "Only a daily schedule exists in the MVP (BKP-002).",
              "const": "daily",
              "default": "daily"
            },
            "at": {
              "description": "Local time of day in `timezone`.",
              "type": "string",
              "pattern": "^([01][0-9]|2[0-3]):[0-5][0-9]$",
              "default": "03:00"
            },
            "timezone": {
              "description": "IANA timezone for the schedule. The scheduler evaluates the next due run on a 60-second tick in this zone; a local time that does not exist on a DST transition day runs at the next valid instant and a local time that occurs twice runs at its first occurrence (BKP-026).",
              "type": "string",
              "minLength": 1,
              "default": "UTC"
            },
            "catchUpAfterMissedRun": {
              "description": "Run at most one missed backup after a daemon start; repeated missed intervals never produce a burst (BKP-015).",
              "type": "boolean",
              "default": true
            }
          }
        },
        "commit": {
          "type": "object",
          "additionalProperties": false,
          "required": [
            "messageTemplate"
          ],
          "properties": {
            "messageTemplate": {
              "description": "Commit message template (BKP-010).",
              "type": "string",
              "minLength": 1,
              "default": "sorage backup: {timestamp}"
            }
          }
        },
        "push": {
          "type": "object",
          "additionalProperties": false,
          "required": [
            "enabled",
            "remote",
            "branch"
          ],
          "properties": {
            "enabled": {
              "description": "Remote push, toggled by `sorage backup enable-push` and `sorage backup disable-push` (BKP-011, BKP-025).",
              "type": "boolean",
              "default": false
            },
            "remote": {
              "description": "Git remote name for the push.",
              "type": "string",
              "minLength": 1,
              "default": "origin"
            },
            "branch": {
              "description": "Git branch for the push; only a fast-forward `git push --atomic` is permitted (BKP-013, BKP-014).",
              "type": "string",
              "minLength": 1,
              "default": "main"
            }
          }
        },
        "largeArtifactWarningBytes": {
          "description": "Import prints a warning above this size while Git backup is enabled, because Git history keeps every committed revision of the file forever.",
          "type": "integer",
          "minimum": 1,
          "default": 26214400
        },
        "snapshot": {
          "type": "object",
          "additionalProperties": false,
          "required": [
            "redactWorkspacePaths"
          ],
          "properties": {
            "redactWorkspacePaths": {
              "description": "Redact local filesystem paths from the exported snapshots. When true, `senderPathSnapshot`, Project Binding paths, and path fields inside event `metadataJson` are redacted, and `sorage backup restore` rebuilds the ledger exactly as exported rather than reconstructing the removed paths.",
              "type": "boolean",
              "default": true
            }
          }
        }
      }
    },
    "ui": {
      "type": "object",
      "additionalProperties": false,
      "required": [
        "defaultPageSize",
        "showArchivedByDefault",
        "timezone"
      ],
      "properties": {
        "defaultPageSize": {
          "description": "Default cursor page size for CLI and Web lists.",
          "type": "integer",
          "minimum": 10,
          "maximum": 200,
          "default": 50
        },
        "showArchivedByDefault": {
          "description": "Include archived Handoffs in default listings, the equivalent of `--include-archived` (LIFE-009).",
          "type": "boolean",
          "default": false
        },
        "timezone": {
          "description": "IANA timezone for rendering timestamps. Null means the system timezone. Timestamps are always stored in UTC (NFR-007).",
          "type": [
            "string",
            "null"
          ],
          "minLength": 1,
          "default": null
        }
      }
    },
    "logging": {
      "type": "object",
      "additionalProperties": false,
      "required": [
        "level",
        "includeFullPaths",
        "rotation"
      ],
      "properties": {
        "level": {
          "description": "Structured JSON log level for every Sorage process. The default `warn` keeps a CLI invocation quiet (RUN-009).",
          "enum": [
            "debug",
            "info",
            "warn",
            "error"
          ],
          "default": "warn"
        },
        "includeFullPaths": {
          "description": "Log full filesystem paths. False redacts paths while retaining stable identifiers (SEC-011).",
          "type": "boolean",
          "default": false
        },
        "rotation": {
          "type": "object",
          "additionalProperties": false,
          "required": [
            "maxBytes",
            "maxFiles"
          ],
          "properties": {
            "maxBytes": {
              "description": "Rotate `~/.sorage/logs/sorage.log` once it reaches this size (RUN-009).",
              "type": "integer",
              "minimum": 1,
              "default": 10485760
            },
            "maxFiles": {
              "description": "Number of rotated log files retained.",
              "type": "integer",
              "minimum": 1,
              "default": 5
            }
          }
        }
      }
    },
    "gc": {
      "type": "object",
      "additionalProperties": false,
      "required": [
        "graceHours"
      ],
      "properties": {
        "graceHours": {
          "description": "Age before an unreferenced file under `artifacts/` or an entry under `staging/` may be swept. Garbage collection runs only after the pending intent drain and never deletes a path matching any storageKey or any pending intent (VLT-013, VLT-014).",
          "type": "integer",
          "minimum": 1,
          "default": 24
        }
      }
    }
  }
}
